{
  "$schema": "https://json-schema.org/draft/2020-12/schema",
  "$id": "https://github.com/aegisbpf/aegisbpf/blob/main/config/schemas/capabilities_v1.json",
  "title": "AegisBPF Capabilities Report (v1)",
  "description": "Schema for the node capability report written by the daemon.",
  "type": "object",
  "additionalProperties": false,
  "required": [
    "schema_version",
    "schema_semver",
    "generated_at_unix",
    "kernel_version",
    "capability",
    "audit_only",
    "enforce_capable",
    "enforce_blockers",
    "runtime_state",
    "lsm_enabled",
    "core_supported",
    "future_lsm",
    "next_gen_bpf",
    "features",
    "hooks",
    "policy",
    "requirements",
    "requirements_met",
    "exec_identity",
    "state_transitions"
  ],
  "properties": {
    "schema_version": { "type": "integer", "const": 1 },
    "schema_semver": {
      "type": "string",
      "pattern": "^[0-9]+\\.[0-9]+\\.[0-9]+$"
    },
    "generated_at_unix": { "type": "integer", "minimum": 0 },
    "kernel_version": { "type": "string" },
    "capability": {
      "type": "string",
      "enum": ["Full", "AuditOnly", "Disabled", "Unknown"]
    },
    "audit_only": { "type": "boolean" },
    "enforce_capable": { "type": "boolean" },
    "enforce_blockers": {
      "type": "array",
      "items": { "type": "string" }
    },
    "runtime_state": {
      "type": "string",
      "enum": ["ENFORCE", "ENFORCE_SIGNAL", "AUDIT_FALLBACK", "DEGRADED"]
    },
    "lsm_enabled": { "type": "boolean" },
    "core_supported": { "type": "boolean" },
    "features": {
      "type": "object",
      "additionalProperties": false,
      "required": [
        "bpf_lsm",
        "cgroup_v2",
        "btf",
        "bpf_syscall",
        "ringbuf",
        "tracepoints",
        "bpffs",
        "ima",
        "ima_appraisal",
        "bpf_ima_helpers",
        "landlock",
        "ipe",
        "fs_verity",
        "bpf_token",
        "bpf_arena",
        "user_ringbuf",
        "sched_ext",
        "open_coded_iterators",
        "bpf_xattr_kfuncs",
        "bpf_send_signal_task",
        "binary_auth",
        "overlay_copy_up_propagation",
        "deep_process_lineage",
        "enhanced_rule_engine",
        "cgroup_scoped_deny",
        "policy_generation",
        "deadman_fail_static"
      ],
      "properties": {
        "bpf_lsm": { "type": "boolean" },
        "cgroup_v2": { "type": "boolean" },
        "btf": { "type": "boolean" },
        "bpf_syscall": { "type": "boolean" },
        "ringbuf": { "type": "boolean" },
        "tracepoints": { "type": "boolean" },
        "bpffs": { "type": "boolean" },
        "ima": { "type": "boolean" },
        "ima_appraisal": { "type": "boolean" },
        "bpf_ima_helpers": { "type": "boolean" },
        "landlock": { "type": "boolean" },
        "ipe": { "type": "boolean" },
        "fs_verity": { "type": "boolean" },
        "bpf_token": { "type": "boolean" },
        "bpf_arena": { "type": "boolean" },
        "user_ringbuf": { "type": "boolean" },
        "sched_ext": { "type": "boolean" },
        "open_coded_iterators": { "type": "boolean" },
        "bpf_xattr_kfuncs": { "type": "boolean" },
        "bpf_send_signal_task": { "type": "boolean" },
        "binary_auth": { "type": "boolean" },
        "overlay_copy_up_propagation": { "type": "boolean" },
        "deep_process_lineage": { "type": "boolean" },
        "enhanced_rule_engine": { "type": "boolean" },
        "cgroup_scoped_deny": { "type": "boolean" },
        "policy_generation": { "type": "boolean" },
        "deadman_fail_static": { "type": "boolean" }
      }
    },
    "future_lsm": {
      "type": "object",
      "additionalProperties": false,
      "required": ["active_lsms", "landlock", "landlock_abi", "ipe", "fs_verity", "bpf_token"],
      "properties": {
        "active_lsms": { "type": "string" },
        "landlock": { "type": "boolean" },
        "landlock_abi": { "type": "integer", "minimum": -1 },
        "ipe": { "type": "boolean" },
        "fs_verity": { "type": "boolean" },
        "bpf_token": { "type": "boolean" }
      }
    },
    "next_gen_bpf": {
      "type": "object",
      "additionalProperties": false,
      "required": [
        "arena",
        "user_ringbuf",
        "sched_ext",
        "open_coded_iterators",
        "xattr_kfuncs",
        "bpf_send_signal_task",
        "binary_auth"
      ],
      "properties": {
        "arena": { "type": "boolean" },
        "user_ringbuf": { "type": "boolean" },
        "sched_ext": { "type": "boolean" },
        "open_coded_iterators": { "type": "boolean" },
        "xattr_kfuncs": { "type": "boolean" },
        "bpf_send_signal_task": { "type": "boolean" },
        "binary_auth": { "type": "boolean" }
      }
    },
    "hooks": {
      "type": "object",
      "additionalProperties": false,
      "required": [
        "lsm_file_open",
        "lsm_inode_permission",
        "lsm_bprm_check_security",
        "lsm_file_mmap",
        "lsm_socket_connect",
        "lsm_socket_bind",
        "lsm_socket_listen",
        "lsm_socket_accept",
        "lsm_socket_sendmsg",
        "lsm_socket_recvmsg",
        "lsm_inode_copy_up",
        "lsm_bprm_ima_check"
      ],
      "properties": {
        "lsm_file_open": { "type": "boolean" },
        "lsm_inode_permission": { "type": "boolean" },
        "lsm_bprm_check_security": { "type": "boolean" },
        "lsm_file_mmap": { "type": "boolean" },
        "lsm_socket_connect": { "type": "boolean" },
        "lsm_socket_bind": { "type": "boolean" },
        "lsm_socket_listen": { "type": "boolean" },
        "lsm_socket_accept": { "type": "boolean" },
        "lsm_socket_sendmsg": { "type": "boolean" },
        "lsm_socket_recvmsg": { "type": "boolean" },
        "lsm_inode_copy_up": { "type": "boolean" },
        "lsm_bprm_ima_check": { "type": "boolean" }
      }
    },
    "policy": {
      "type": "object",
      "additionalProperties": false,
      "required": [
        "applied_path",
        "snapshot_present",
        "parse_ok",
        "network_rule_count",
        "protect_path_count",
        "protect_connect",
        "protect_runtime_deps",
        "require_ima_appraisal",
        "allow_binary_hash_count",
        "cgroup_deny_inode_count",
        "cgroup_deny_ip_count",
        "cgroup_deny_port_count"
      ],
      "properties": {
        "applied_path": { "type": "string" },
        "snapshot_present": { "type": "boolean" },
        "parse_ok": { "type": "boolean" },
        "network_rule_count": { "type": "integer", "minimum": 0 },
        "protect_path_count": { "type": "integer", "minimum": 0 },
        "protect_connect": { "type": "boolean" },
        "protect_runtime_deps": { "type": "boolean" },
        "require_ima_appraisal": { "type": "boolean" },
        "allow_binary_hash_count": { "type": "integer", "minimum": 0 },
        "cgroup_deny_inode_count": { "type": "integer", "minimum": 0 },
        "cgroup_deny_ip_count": { "type": "integer", "minimum": 0 },
        "cgroup_deny_port_count": { "type": "integer", "minimum": 0 }
      }
    },
    "requirements": {
      "type": "object",
      "additionalProperties": false,
      "required": [
        "network_enforcement_required",
        "network_connect_required",
        "network_bind_required",
        "exec_identity_required",
        "exec_allowlist_required",
        "verified_exec_required",
        "verified_exec_runtime_deps_required",
        "ima_appraisal_required"
      ],
      "properties": {
        "network_enforcement_required": { "type": "boolean" },
        "network_connect_required": { "type": "boolean" },
        "network_bind_required": { "type": "boolean" },
        "exec_identity_required": { "type": "boolean" },
        "exec_allowlist_required": { "type": "boolean" },
        "verified_exec_required": { "type": "boolean" },
        "verified_exec_runtime_deps_required": { "type": "boolean" },
        "ima_appraisal_required": { "type": "boolean" }
      }
    },
    "requirements_met": {
      "type": "object",
      "additionalProperties": false,
      "required": ["network", "exec_identity", "exec_runtime_deps", "ima_appraisal"],
      "properties": {
        "network": { "type": "boolean" },
        "exec_identity": { "type": "boolean" },
        "exec_runtime_deps": { "type": "boolean" },
        "ima_appraisal": { "type": "boolean" }
      }
    },
    "exec_identity": {
      "type": "object",
      "additionalProperties": false,
      "required": [
        "kernel_enabled",
        "kernel_allow_exec_inode_entries",
        "runtime_deps_hook_attached",
        "userspace_fallback_allowlist_entries"
      ],
      "properties": {
        "kernel_enabled": { "type": "boolean" },
        "kernel_allow_exec_inode_entries": { "type": "integer", "minimum": 0 },
        "runtime_deps_hook_attached": { "type": "boolean" },
        "userspace_fallback_allowlist_entries": { "type": "integer", "minimum": 0 }
      }
    },
    "state_transitions": {
      "type": "object",
      "additionalProperties": false,
      "required": ["total", "degradation_total", "strict_mode", "enforce_requested"],
      "properties": {
        "total": { "type": "integer", "minimum": 0 },
        "degradation_total": { "type": "integer", "minimum": 0 },
        "strict_mode": { "type": "boolean" },
        "enforce_requested": { "type": "boolean" }
      }
    }
  }
}
