{
  "schema_version": 1,
  "schema_semver": "1.8.0",
  "generated_at_unix": 1700000000,
  "kernel_version": "6.14.0-37-generic",
  "capability": "Full",
  "audit_only": false,
  "enforce_capable": true,
  "enforce_blockers": [],
  "runtime_state": "ENFORCE",
  "lsm_enabled": true,
  "core_supported": true,
  "future_lsm": {
    "active_lsms": "lockdown,capability,landlock,yama,ipe,bpf,integrity",
    "landlock": true,
    "landlock_abi": 4,
    "ipe": true,
    "fs_verity": true,
    "bpf_token": true
  },
  "next_gen_bpf": {
    "arena": true,
    "user_ringbuf": true,
    "sched_ext": true,
    "open_coded_iterators": true,
    "xattr_kfuncs": true,
    "bpf_send_signal_task": true,
    "binary_auth": true
  },
  "features": {
    "bpf_lsm": true,
    "cgroup_v2": true,
    "btf": true,
    "bpf_syscall": true,
    "ringbuf": true,
    "tracepoints": true,
    "bpffs": true,
    "ima": true,
    "ima_appraisal": true,
    "bpf_ima_helpers": true,
    "landlock": true,
    "ipe": true,
    "fs_verity": true,
    "bpf_token": true,
    "bpf_arena": true,
    "user_ringbuf": true,
    "sched_ext": true,
    "open_coded_iterators": true,
    "bpf_xattr_kfuncs": true,
    "bpf_send_signal_task": true,
    "binary_auth": true,
    "overlay_copy_up_propagation": true,
    "deep_process_lineage": true,
    "enhanced_rule_engine": true,
    "cgroup_scoped_deny": true,
    "policy_generation": true,
    "deadman_fail_static": true
  },
  "hooks": {
    "lsm_file_open": true,
    "lsm_inode_permission": true,
    "lsm_bprm_check_security": true,
    "lsm_file_mmap": true,
    "lsm_socket_connect": true,
    "lsm_socket_bind": true,
    "lsm_socket_listen": true,
    "lsm_socket_accept": true,
    "lsm_socket_sendmsg": true,
    "lsm_socket_recvmsg": true,
    "lsm_inode_copy_up": true,
    "lsm_bprm_ima_check": true
  },
  "policy": {
    "applied_path": "/etc/aegisbpf/policy.applied",
    "snapshot_present": true,
    "parse_ok": true,
    "network_rule_count": 0,
    "protect_path_count": 0,
    "protect_connect": false,
    "protect_runtime_deps": false,
    "require_ima_appraisal": false,
    "allow_binary_hash_count": 0,
    "cgroup_deny_inode_count": 0,
    "cgroup_deny_ip_count": 0,
    "cgroup_deny_port_count": 0
  },
  "requirements": {
    "network_enforcement_required": false,
    "network_connect_required": false,
    "network_bind_required": false,
    "exec_identity_required": false,
    "exec_allowlist_required": false,
    "verified_exec_required": false,
    "verified_exec_runtime_deps_required": false,
    "ima_appraisal_required": false
  },
  "requirements_met": {
    "network": true,
    "exec_identity": true,
    "exec_runtime_deps": true,
    "ima_appraisal": true
  },
  "exec_identity": {
    "kernel_enabled": true,
    "kernel_allow_exec_inode_entries": 0,
    "runtime_deps_hook_attached": true,
    "userspace_fallback_allowlist_entries": 0
  },
  "state_transitions": {
    "total": 1,
    "degradation_total": 0,
    "strict_mode": false,
    "enforce_requested": true
  }
}
